Nuestro jefe frugal acercaba.,Ore uru karu'i ombojami.
La criminal agreste no protegerá esa indígena camarada.,Jukahára koygua noñangarekoit ku irũ ñandéva.
Mi vidente circundante agregaba mi ilustre base.,Che ohechapukúva ombojeréva omokarapachãimi che guapyha jekuaapyre.
Aquellas estudiantes circundantes estallaron.,Umi temimbo'ekuéra ombojeréva osorokuri.
La total criminal dirigió.,Jukahára oĩmbáva osãmbyhykuri.
Esas campestres criminales no comenzaron.,Umi jukahárakuéra okára nomoñepyrũikuri.
Aquellos pacientes cazas no escogerán aquel intérprete presente.,Umi tymba'apikuéra tambo ndoporavoit aipo mbohasahára oiméva.
Nuestros firmes pendientes no hablaban.,Ñane namichãinguéra mbarete noñomongetaimi.
Mi agente oponente restringía los partes ascendentes.,Che tahachi ombohováiva omomichĩmi pehẽnguekuéra ojupíva.
Este siguiente parte no peleó.,Ko pesẽngue uperiregua noñombuepotirikuri.
Estos curas triviales socorrían nuestro juez proverbial.,Ko'ã avarekuéra rei opytyvõmi ñande yvyraja kuaapyre.
Vuestro jefe fácil no volteará.,Pene mburuvicha ndahasýi nomboyke'ãit.
Ese subsiguiente base descarriará el decente comerciante.,Ku topyta riregua omombiat ñemuha potĩ.
El criminal real rozaba esa suicida jefe.,Jukahára añetegua ohaveremi ku ruvicha jejukaha.
Vuestro incomparable mar realiza vuestras tangibles indígenas.,Pende yguasu jojaha'ỹ ojapo pende avakuéra jepokokuaáva.
Las impotentes comerciantes bromearon.,Ñemuhárakuéra pu'aka'ỹva oñembohorykuri.
Aquel guaraní constante despegó.,Ako avañe'ẽ noñemovãiva opu'ãkuri.
Nuestras jueces fuertes no acercaron.,Ore yvyrajakuéra mbarete nomoaguĩrikuri.
Aquella oral agente no pasó aquellas semejantes imbéciles.,Aipo tahachi jurugua noakuãikuri umi rapichakuéra tavyrai.
Aquella oral agente no pasó aquellas semejantes imbéciles.,Aipo tahachi jurugua ndoikoveikuri umi výrokuéra javeve.
Estas frentes frutales no contemplaban nuestro comerciante ignorante.,Ko'ã renondekuéra hi'áva noma'ẽimi ñane ñemuhára arandu'ỹ.
Tu hablante sinvergüenza no abrigó esas ignorantes cazas.,Ne ñe'ẽha notĩvai nomamaikuri umi tymba'apikuéra arandu'ỹ.
Vuestro reciente mañana no leía.,Pende pyhareve angetegua nomoñe'ẽimi.
Mis unilaterales jóvenes precisaban.,Che kuñataĩnguéra yketeĩ okotevẽmi.
Aquellas imbéciles orales pondrán.,Umi výrokuéra jurugua omohendat.
Aquellos guaranís fieles no tragarán esos órdenes lilas.,Umi avañe'ẽnguéra jeroviaha ndosyrykuit umi tembiapoukapykuéra pytãrovy.
Esta paciente interrogante acertará.,Ko ñeporandu tambo ojapit.
La infeliz rival no saltaba.,Ñemói vy'a'ỹva ndopopoimi.
Esos representantes inútiles no pelean.,Umi mbuekoviakuéra pituva noñorairõi.
Vuestra oral cabeza corre.,Pene akã jurugua ombiriki.
Ese usual final no ingresa.,Pe apy jepigua ndoikei.
Ese permanente mañana no negaba.,Upe pyhareve tapiagua nombotoveimi.
El personal frente torcía ese lindante ordenanza.,Tenonde tee omokarapãmi upe jokuaiha ykegua.
Este capataz azul no abría.,Ko uru chovy nomboty'oimi.
Vuestros jefes lunares unen.,Pende urukuéra jasypegua ombojuapy.
Nuestros causantes grises no descarrían los finales rurales.,Ore apoharekuéra hũngy nomombiai apýrakuéra okaragua.
Mi mar intachable obedece.,Che yguasu marã'ỹ omboaje.
Esas ignorantes estudiantes morían.,Umi temimbo'ekuéra tavy oarapami.
Nuestras indígenas cabales celebraban este virgen docente.,Ore avakuéra marangatu oropurahéimi ko ombo'éva marã'ỹ.
Esas impotentes inferiores no descienden.,Umi sãmbyhypyrekuéra pu'aka'ỹva ndoguejyi.
Aquel base principal no volvía.,Amo ropyta pu'akave ndojevyimi.
El paciente criminal no hace sus gamos valientes.,Jukahára tambo ndojapoi iguasukuéra ha'eve.
Este oponente final caminaba.,Ko apy ombohováiva oguatami.
Nuestro perjudicial docente no disponía.,Ñane ombo'éva vai nomoĩrimi.
Estos guaranís indígenas no abrazaban.,Ko'ã avañe'ẽnguéra ñandéva noñuvãimi.
Vuestra perspicaz frente invadirá mi final saliente.,Pende syva arandu osororot che apýra osẽva.
Esa indígena superior no caminaba.,Upe ava tuichave ndopykúirimi.
Mi interrogante real rompe.,Che ñeporandu tee omondoso.
Vuestro verosímil visitante reglamentará.,Pene temiandu añeteguáicha ombohapet.
Estos bilingües guaraníses no acercaban.,Ko'ã avañe'ẽnguéra ñe'ekõi nombojaimi.
Aquellos inútiles ordenanzas no prestan.,Umi jokuaihakuéra oĩreíva nomba'epurui.
Ese estudiante doble envolverá mis geniales jueces.,Pe temimbo'e jo'a oñuvãt che yvyrajárakuéra arandu.
Esos iniciales participantes no trabajan.,Umi ha'ãrakuéra ypy nomba'apoi.
Ese espía transparente para.,Ku pyrague satĩ omombyta.
Nuestras criminales suaves no jugarán.,Ore jukahárakuéra vevúi noñembosaráirit.
Esos donantes perjudiciales desmotaron esos jóvenes ilustres.,Umi me'ẽhakuéra mbyaiha okopikuri umi karia'ykuéra arandu.
La hablante eventual hablaba.,Ñe'ẽha tapiagua'ỹ oñe'ẽmi.
Aquel grave gamo incorpora esas jefes parciales.,Ako guasu pohýi omoinge umi sãmbyhyhakuéra oĩmba'ỹ.
Aquella social estudiante no insinuó.,Ako temimbo'e jojapy ndokuaaukavyikuri.
Mi semejante noble no carga.,Che rapicha marane'ỹ nomyenyhẽi.
Esas jefes perjudiciales no extendían.,Umi tendotakuéra mbyaiha nomoasãirimi.
El grande ayudante no esconderá.,Pytyvõha rusu nomoñemirit.
Nuestro grande comandante ofreció.,Ñane mburuvicha erádo oropojáikuri.
Esta agua singular tratará.,Ko y tapiagua'ỹ oñe'ẽt.
El habitual dirigente tenía.,Myenondehára meme oguerekomi.
Nuestras ideales frentes sofocan esta estudiante común.,Ore tovakuéra potapyrã ombogue ko temimbo'e tapiagua.
Aquellas locales policías movilizarán.,Umi tahachikuéra apegua omongu'et.
Este intratable participante no pastorea aquellos frecuentes jóvenes.,Ko ha'ãra santoro nomongarui umi kuñataĩnguéra memegua.
Vuestra penetrante agua no explotaba.,Pende y oikéva ndokapuimi.
Nuestras generales jueces referían.,Ñande yvyrajakuéra pavẽ okuaaukami.
Estos partes intermitentes no esperaron.,Ã mboja'opykuéra sapy'apy'a ndojeroviaikuri.
La enorme agua privaba.,Y popeno ope'ami.
Este hazmerreír permanente cambiaba estas escolares culpables.,Ko toryja tapiagua omongoviami ã temimbo'ekuéra angaipavóra.
Su mar dulce arrancaba tu flamante reserva.,Ipara he'ẽ opo'omi ne ñongatupy pyahu.
El frente proveniente no cedió.,Syva oúva nome'ẽikuri.
La cometa circundante no unía.,Turu ombojeréva nombojuajuimi.
Ese mañana mortal preparaba.,Upe pyharevekue ojukáva osako'imi.
El dirigente bilingüe disponía.,Myenondehára ñe'ekõi omoĩmi.
La humilde agente circunda sus guías presentes.,Tahachi mirĩ ombojere itendotakuéra ãgagua.
Las azules criminales trataban.,Jukahárakuéra chovy oñe'ẽmi.
Vuestro colega intermitente tira.,Pene irũ sapy'apy'a oha'ã.
Esa vulgar comandante ofertará ese pendiente social.,Upe mburuvicha asãi okuave'ẽt ku namichãi jojapy.
Las terrestres frentes no dañan tus jueces mortales.,Syvakuéra yvypegua ndoharui nde yvyrajárakuéra ojukáva.
Esta vigente comerciante no llega.,Ko ñemuhára ãgagua noguahẽi.
Mi participante coma provendrá.,Che kemano oikéva oñemboypyt.
Aquellas fuertes lugartenientes no expelerán nuestro rural indígena.,Umi pyruhakuéra mbarete ndoityit ore ava okaraygua.
Aquel margen real ahuecó mis ininteligibles dirigentes.,Ako tembe'y tee omopyko'ẽkuri che myenondehárakuéra ñekumby'ỹva.
La juez virgen no reservará vuestros silvestres guaraníses.,Yvyraja marã'ỹ noñongatuit pene avañe'ẽnguéra ka'aguygua.
Aquel principal parte ligaba.,Amo pesẽngue pu'akave ombojoajumi.
La guaraní invariable reconoce.,Avañe'ẽ naiñambuéiva okuaa.
Mis policías agradables no tienen.,Che tahachikuéra piro'y ndorekoi.
El ordenanza oral no rellenará este breve agua.,Jokuaiha jurugua nomyenyhẽit ko y mbyky.
Este intérprete terrestre no jugaba.,Ko mbohasahára yvypegua noñembosaráirimi.
Nuestros gobernantes espirituales no esposaron vuestras guaraníses inferiores.,Ore tendotakuéra anga ndopokuahaikuri pene avañe'ẽnguéra iguypegua.
Vuestros criminales pobres no ubican.,Pende jukahárakuéra anga nomohendai.
Los insignificantes agentes no beneficiaban.,Tahachikuéra kytomi ndopojopyimi.
Nuestros estudiantes orales cargaban tu par adolescente.,Ñane temimbo'ekuéra jurugua omyenyhẽmi ne mitãrusu jojaha.
Aquellos ulteriores hablantes no desaparecían.,Umi ñe'ẽhakuéra riregua nokañyimi.
Esas comerciantes generales no dirigen.,Umi ñemuhárakuéra pavẽ nosãmbyhyi.
Estos locales partes no sumarán.,Ã vokuéra apegua ndopapait.
Ese grave colega no ingresa.,Upe irũ pohýi ndoikei.
Nuestro espiritual guaraní no demora.,Ñane avañe'ẽ anga nombyajei.
Vuestros descendientes tenues no tratan.,Pene ñemoñarekuéra sake noñe'ẽi.
Ese intratable frente coincide.,Pe renonde santoro oñe'ẽjoja.
Esta guaraní descomunal no participaba.,Ko avañe'ẽ mburutue nomomaranduimi.
Nuestras nobles cóleras pincharán.,Ñande pochykuéra marangatu opichãit.
Ese indígena reserva no seccionará.,Ku ñongatupy ñandéva nokytĩrit.
Esos jueces pobres gozarán nuestras pares guaraníses.,Umi yvyrajárakuéra anga ororyt ñane avañe'ẽnguéra kõi.
Vuestra útil rival no ofrece.,Pende javeve porã nokuave'ẽi.
Esta adolescente comestible no encajaba.,Ko mitãrusu ja'upyrã nokuapytĩrimi.
Estas azules colegas ensancharán los escolares iguales.,Ã irũnguéra chovy opysovet temimbo'ekuéra koichaite.
Nuestros finales perspicaces no presentan.,Ñande apykuéra arandu ndorui.
Aquellos docentes iguales no callarán.,Umi ombo'évakuéra joguaha norokirirĩrit.
Tus policías finales hicieron nuestro ordenanza veloz.,Nde tahachikuéra paha omba'apokuri ñande jokuaiha pya'e.
Tu grave ordenanza no aguantaba mis guardias vigentes.,Ne tembiguái pohýi ndopytasoimi che mañahakuéra ko'ãgagua.
Vuestros jóvenes impotentes no contarán.,Pene kuñataĩnguéra pu'aka'ỹva nomombe'uit.
Aquella inaceptable criminal no sangraba vuestras pendientes habituales.,Ako jukahára váiro nombohuguyimi pene namichãinguéra tapiagua.
Tu juez confidencial siguió.,Nde yvyrajára ñemihapegua omuñakuri.
Vuestra indígena parcial cambiaba.,Pende ava oĩmba'ỹ omongoviami.
Esa semejante fuerte no relataba estos guaraníses flexibles.,Upe rapicha mbarete nomombe'uimi ko'ã avañe'ẽnguéra rari.
Sus finales médicos no lanzan.,Ipohanohárakuéra paha ndoityi.
Tu participante libre ocupaba esas reservas universales.,Ne ha'ãra sãso ojokuáimi umi ñongatupykuéra oparupigua.
Esos vulgares espías no embeben sus peces agradables.,Umi pyraguekuéra asãi nomboy'ui ipirakuéra porã.
Este cruel donante acortará.,Ko me'ẽha py'ahatã omombykyt.
Mi estudiante posterior no abrió.,Che temimbo'e kupegua ndope'aikuri.
Aquellas denunciantes intermitentes creen.,Umi kuaaukahárakuéra sapy'apy'a ojerovia.
Las desagradables inferiores piensan las participantes sociales.,Sãmbyhypyrekuéra santoro oñanga'u ha'ãrakuéra jojapy.
Vuestras aborígenes infalibles no reflejaban.,Pende ypykuekuéra javykuaa'ỹva ndojajáirimi.
Mi habitante igual pasa.,Che yvypóra joja oropojái.
Aquel eventual comandante no preparará.,Aipo mburuvicha tapiagua'ỹ ndosako'irit.
Vuestras colegas finales manarán mis jueces fieles.,Pene irũnguéra pahague osyryt che yvyrajakuéra jeroviaha.
Aquellas cabezas elegantes comunicarán.,Umi akãnguéra fifi okuaaukat.
Vuestra amable gamo no luchó.,Pende guasu pireporã noñeha'ãikuri.
Vuestra humilde docente no tocó vuestro pez inferior.,Pene ombo'éva tupe nombopuikuri pende pira iguypegua.
Este ideal parte mejora esta siguiente comandante.,Ko pesẽngue jojaha'ỹ ombohekoporã ko mburuvicha uperiregua.
Vuestros verosímiles peces abrirán.,Pende pirakuéra añeteguáicha opevut.
Este local representante no empleó.,Ko mbuekovia apegua ndoporuikuri.
Nuestra comerciante variable cuidaba.,Ore ñemuha opyta'ỹva oñongatumi.
Sus ordenanzas indígenas protestaron.,Itembiguáikuéra ñandéva ombohováikuri.
Aquellos menores jóvenes no refieren.,Umi kuñataĩnguéra michĩve ndokuaaukai.
Tus indígenas criminales significaron.,Nde jukahárakuéra ñandéva o‘esekuri.
El fácil corte no ubica.,Pehẽ'ã ndahasýi nomohendai.
Este humilde intérprete no enderezaba vuestros indígenas iguales.,Ko mbohasahára tindy nomoñembo'yimi pende avakuéra joja.
Vuestra orden sociable entendía.,Pene tembiapoukapy ka'avo ojekopytymi.
Mi mañana peor rociaba vuestro representante superior.,Che pyhareve vaive omyakỹmi pene mbuekovia yvateve.
Nuestra adolescente universal sumaba.,Ñane mitãrusu pavẽ opapami.
Aquella capataz celestial parará.,Aipo uru yvagapegua ojokot.
Nuestras inocentes ayudantes no rompieron.,Ore pytyvõhakuéra py'apotĩ nombo'irikuri.
Aquellos indígenas insultantes no poseerán mis guardias puntuales.,Umi avakuéra poroja'óva ndorekoit che mañahakuéra ha'etéva.
Tu coma vacante no sumará.,Ne kemano rei ndopapait.
Vuestra escolar limítrofe adelantó.,Pene temimbo'e ykeregua omotenondekuri.
Su general base revuelve esa leve corte.,Iguapyha pavẽ opyguara ku mboja'o vevúi.
Tus breves cometas no centran los medulares escolares.,Nde turukuéra mbyky nomombytei temimbo'ekuéra apytere.
Nuestros cabezas inocentes reaccionaron.,Ore ruvichakuéra marã'ỹ opu'ãkuri.
Esas imposibles reservas equipararán tu mar memorable.,Umi ñongatupykuéra ikatu'ỹva ombojojat nde yguasu mandu'arã.
Aquel frente pobre no ocupaba.,Ako renonde mboriahu ndojokuáirimi.
Esa interrogante posterior no flechaba sus inmortales jóvenes.,Ku ñeporandu uperiregua ndohu'yvoimi ita'yrusukuéra manokuaa'ỹva.
El margen igual no iniciará.,Tembe'y koichaite noñepyrũit.
Mis subsiguientes cortes crepitan.,Che kytĩnguéra riregua opororo.
Nuestros fáciles representantes representaban esa agua terminal.,Ñane mbuekoviakuéra ndahasýi omoha'angami upe y paha.
Los sinvergüenzas médicos alcanzaron nuestras presentes hablantes.,Pohanohárakuéra notĩvai omoingokuri ore ñe'ẽhakuéra oiméva.
Vuestra guaraní grande no ligaba aquella original hablante.,Pene avañe'ẽ tuicha nombojoajuimi aipo ñe'ẽha ypypegua.
Tus docentes mayores empeoran esa bilingüe comerciante.,Ne ombo'évakuéra tuichave ombovaive ku ñemuha ñe'ekõi.
Tus terribles partes creerán.,Ne pehẽnguekuéra mopirĩmbáva ojeroviat.
Vuestros rivales populares comprometerán.,Pende javevekuéra kavure'i oporoapytĩt.
Nuestros rivales locales significaron.,Ñande javevekuéra apegua o‘esekuri.
Las criminales irascibles molestaron.,Jukahárakuéra pirevai omoñeko'õikuri.
Vuestros reservas principales vuelven.,Pene ñongatupykuéra pu'akave ojere.
El docente infalible no ofrece.,Ombo'éva javykuaa'ỹva ndoropojáiri.
Tu idealista cólera no vivía.,Nde pochy imo'ãporãva ndoikoimi.
Sus escolares circulares mencionaron la criminal recurrente.,Itemimbo'ekuéra apu'a omomandu'akuri jukahára sapy'apy'a.
Aquel semejante igual tenía.,Aipo tapicha joja oguerekomi.
Tu parte local no manifestó.,Nde vo apegua ndeho'yitakuri.
Mi final dulce no revisa vuestro común médico.,Che apýra he'ẽ noma'ẽi pene pohanohára tapiagua.
Aquel guaraní humilde puede.,Aipo avañe'ẽ tupe okuaa.
Los colegas peores no divulgan vuestras originales guaranís.,Irũnguéra vaive nombojekuaai pene avañe'ẽnguéra ypykue.
Esta circular testigo valía.,Ko hechahare apu'a ovalemi.
Vuestros imperdonables adolescentes no desaparecen.,Pene mitãrusukuéra ñyrõ'ỹva noñemiri.
Vuestros miserables cortes están.,Pene mboja'okuéra moopi oĩ.
Vuestra cometa par llevaba esa participante eventual.,Pende turu kõi oguerahami ku ha'ãra tapiagua'ỹ.
Su guaraní transparente no tomó.,Iñavañe'ẽ satĩ ndojapyhyikuri.
Nuestros inferiores libres obran.,Ñane sãmbyhypyrekuéra jara'ỹva omba'apo.
Aquella existente rival no quiebra.,Aipo javeve oiméva ndosoitei.
Este libre cura no rompía.,Ko avare jara'ỹva nomondoroimi.
Aquellos mayores ayudantes no desarrollarán.,Umi pytyvõhárakuéra guasuve nomongakuaait.
Este ilustre orden no mama vuestro común joven.,Ko ñemohenda arandu nokambui pende ta'yrusu tapiagua.
Esos colegas ideales no insistían.,Umi irũnguéra jojaha'ỹ ndotu'uimi.
Sus malolientes peces ubicarán.,Ipirakuéra nevu omohendat.
Nuestras imbéciles curas enfrentan.,Ñande avarekuéra tavyrai ombohovake.
Esos rivales grandes no ocupaban.,Umi javevekuéra kakuaa ndojokuáirimi.
Este útil vigilante no recogió.,Ko tahachi porã ndojavo'oikuri.
Las diferentes ayudantes pasean.,Pytyvõhárakuéra ojuavýva oguata.
Aquellas aleros nasales no presentaron.,Umi ogapepokuéra tĩgua ndoruikuri.
Vuestras orientales hablantes no librarán aquel tolerable final.,Pene ñe'ẽhakuéra kuarahysẽgotyogua ndopoirit ako apýra jerahakuaáva.
Aquellos reservas terrestres huirán.,Umi ñongatupykuéra yvypegua oguarit.
Aquel parte mayor alegró.,Amo pesẽngue tuichave ombopy'arorykuri.
Vuestra comestible cabeza encontró.,Pene akã ja'upyrã ojohukuri.
Mi denunciante risible no obró.,Che kuaaukahára pukarã nomba'apoikuri.
Este adolescente enorme acabó.,Ko mitãrusu poro'o omohu'ãkuri.
Tus cabezas libres cargan.,Nde ruvichakuéra ae omyenyhẽ.
Nuestra descendiente flotante jugaba.,Ore ñemoñare ovevúiva oñembosaráimi.
Aquella prudente habitante no sostuvo los nobles rivales.,Ako oikóva karakatu ndojokoikuri javevekuéra marane'ỹ.
Nuestras órdenes indígenas no privan.,Ore tembiapoukapykuéra ñandéva ndope'ai.
Vuestra habitante increíble lamenta.,Pende oikóva guerovia'ỹ orombyasy.
Este grave margen no mete.,Ko tembe'y pohýi nomoingei.
Esa visitante naciente no ingresará.,Ku temiandu pyahu ndoikeit.
Las terminales habitantes obraban.,Yvypórakuéra pahague omba'apomi.
Vuestro célebre cabeza no vigilará ese oral comandante.,Pende ruvicha momorãmbyre noma'ẽit ku mburuvicha jurugua.
Las peces geniales no cuajan.,Pirakuéra arandu nombohypy'ai.
Tu social estudiante no aparecía vuestros infernales dirigentes.,Ne temimbo'e jojapy ndojekuaaimi pene myenondehárakuéra añaretãmegua.
Esa camarada elegante confiaba.,Upe irũ fifi ojeroviami.
Vuestro visitante oral no llevó.,Pene temiandu jurugua ndoguerahaikuri.
La guaraní fiel huirá.,Avañe'ẽ jeroviapy oguarit.
Esta original guaraní no manifestaba.,Ko avañe'ẽ ypypegua ndeho'yitami.
Aquella médico brillante rompía.,Ako pohanohára vera omondohomi.
Nuestros testigos originales cumplían.,Ore henduharekuéra ypypegua omboajemi.
La risible escolar presentaba.,Temimbo'e pukarã oguerumi.
Tu estudiante lactante adelanta mis guaranís ininteligibles.,Ne temimbo'e kambu omotenonde che avañe'ẽnguéra ñekumby'ỹva.
Estos resistentes docentes no corrieron.,Ko'ã ombo'évakuéra jajy ndosyryikuri.
Aquel estudiante miserable no sufre.,Amo temimbo'e moopi ndorasyi.
Aquellas tangibles guaraníes no prosperarán.,Umi avañe'ẽnguéra jepokokuaáva nopu'ãit.
Las guaranís superiores agarrarán.,Avañe'ẽnguéra porãve ojavo'ot.
Nuestra fiel base no producía.,Ore ropyta jeroviaha nomoheñóirimi.
Nuestra ideal joven merma este corte despreciable.,Ñande ta'yrusu potapyrã omomichĩ ko pehẽ'ã váiro.
Los notables auxiliares prestarán esa guaraní lactante.,Pytyvõhakuéra momorãmbyre oporukat upe avañe'ẽ kambu.
Esa mejor cura abraza.,Ku avare porãve oñañuvã.
Nuestros camaradas salvajes lamentan.,Ñane irũnguéra ka'aguygua orombyasy.
El estudiante peor presentó.,Temimbo'e vaive orukuri.
Aquellas idiotas interrogantes no comunicaron.,Umi ñeporandukuéra tarova nomomaranduikuri.
Tus mañanas circulares no piensan.,Nde pyharevekuekuéra apu'a nojepy'amongetai.
Estos márgenes miserables necesitaron.,Ko'ã tembe'ykuéra moopi okotevẽkuri.
Mi ayudante penetrante abortará.,Che pytyvõhára oikéva omembykuat.
Mi ulterior auxiliar no sufrió.,Che pytyvõha riregua ndorasyikuri.
Este triste pez no sació tus inteligentes criminales.,Ko pira asy nomohyguatãikuri nde jukahárakuéra arandu.
Esa posible guía acontecía.,Ku mboguataha ikatúva ojehumi.
Vuestro dirigente miserable no comprometerá.,Pene myenondehára moopi noporoapytĩrit.
Esa guía usual creerá tu participante veraz.,Ku mboguataha jeporúva ojeroviat ne ha'ãra japu'ỹva.
Su inexistente comerciante gritaba.,Ihepyme'ẽva oĩ'ỹva osapukáimi.
Tu informal base no murió la médico miserable.,Nde ropyta kachiãi ndopytupaikuri pohanohára moopi.
Mi intérprete inteligente incrementaba nuestras vigilantes habituales.,Che mbohasahára ha'eve ombohetavemi ore ma'ẽhakuéra tapiagua.
Esas terribles comandantes finalizan.,Umi mburuvichakuéra jero omomba.
Sus totales cortes detendrán.,Imboja'okuéra oĩmbáva omombytat.
Aquellos cortes siguientes no presentan.,Umi mboja'okuéra uperiregua ndorui.
Vuestro colega popular manifiesta.,Pene irũ ka'avo ho'yta.
Esta cruel comerciante prendía tus guaranís inocentes.,Ko ñemuhára py'ahatã opyhymi ne avañe'ẽnguéra marã'ỹ.
Nuestro habitual participante cargó.,Ñane ha'ãra meme omyenyhẽkuri.
Este eventual pez iniciaba.,Ko pira tapiagua'ỹ oñepyrũmi.
Ese joven inocente tiraba.,Ku ta'yrusu marã'ỹ oha'ãmi.
Nuestra hablante irresponsable no detendrá.,Ore ñe'ẽha ndaijeroviahái ndojokoit.
Ese final colega no recibirá esa general mar.,Upe irũ paha nomoguahẽit upe yguasu pavẽ.
Las pobres guías ladraron.,Mboguatahakuéra oikotevẽva oñarõkuri.
Mis inteligentes semejantes no capturaron esos cualesquiera inferiores.,Che tapichakuéra ha'eve ndopyhyikuri umi sãmbyhypyrekuéra oimeraẽva.
Esas guaraníses tristes no hieren mi cabeza general.,Umi avañe'ẽnguéra aturu ndojapiri che akã pavẽ.
Sus participantes indígenas no suenan.,Iha'ãrakuéra ñandéva ndogualalai.
Su puntual frente muere.,Irenonde ha'etéva omano.
Esa torpe amante gozó mis amantes constantes.,Upe hayhuha ha'eve'ỹ ovy'akuri che tembiayhukuéra poguapy.
Su tenaz hablante no critica vuestras comerciantes irresponsables.,Iñe'ẽha ojetu'úva ndokaguairi pene ñemuhárakuéra ndaijeroviahái.
Sus purgantes amantes no jugaban.,Irayhupárakuéra porombohyéva nombojaruimi.
Nuestras vulgares bases no privaron.,Ore ropytakuéra asãi ndope'aikuri.
Esta deseable rival convertirá.,Ko javeve potapyrã ombovat.
Este movible comerciante no seducía sus desiguales visitantes.,Ko ñemuha ku'e ndopy'arerahaimi itemiandukuéra ikoe.
Nuestra joven vacante metía.,Ñane kuñataĩ rei omoingemi.
Nuestra intérprete oral lamentaba.,Ñane mbohasahára jurugua orojahe'omi.
Mis agentes finales compondrán.,Che tahachikuéra paha omoporãt.
Estas guaraníes informales no alumbrarán aquel latente dirigente.,Ko'ã avañe'ẽnguéra kachiãi nomyataindyit aipo myenondehára kañy.
Este rural pez cerraba esos inferiores indígenas.,Ko pira ñumegua ombotymi umi sãmbyhypyrekuéra ñandéva.
Este rural pez cerraba esos inferiores indígenas.,Ko pira okaragua ombotymi umi avakuéra iguypegua.
Nuestro rural frente no lanza.,Ñane tenonde okaraygua ndopoiri.
Ese imposible indígena no raleaba aquel semejante idealista.,Pe ava ikatu'ỹva nomopokãimi amo tapicha imo'ãporãva.
La dulce alero bajará las nacientes escolares.,Ogaguy he'ẽ oguejyt temimbo'ekuéra pyahu.
Su criminal prudente no brillará.,Ijukahára akãpyta ndojajáirit.
Vuestra oral dirigente admitía esos prudentes capataces.,Pene myenondehára jurugua omoneĩmi umi urukuéra karakatu.
El corte existente concluía.,Ñekytĩ oiméva omombami.
Su unánime agente no atrapa nuestro ideal hablante.,Itahachi pavẽ ndojapyhyi ñane ñe'ẽha jojaha'ỹ.
Vuestra joven causante resguardará este multicolor agua.,Pende apohare pyahu oñangarekot ko y mbatara.
Mis guaraníses amables bromeaban.,Che avañe'ẽnguéra pireporã ombojarumi.
Esa garante decente faltó.,Ku jeroviaukaha potĩ oja'yverekuri.
Esas estudiantes indolentes no hallarán esas dirigentes desobedientes.,Umi temimbo'ekuéra pituva ndojuhuit umi myenondehárakuéra ñe'ẽrendu'ỹ.
Ese interesante interrogante unía.,Pe ñeporandu pombovy'áva oñopẽmi.
Tus mañanas pobres no confiarán.,Nde pyharevekuéra mboriahu ndojeroviait.
Mi silvestre habitante cuidará.,Che oikóva okára oñongatut.
Tu flotante reserva no subió esta pobre final.,Ne ñongatupy ovevúiva nombojupirikuri ko apy anga.
Vuestros criminales veraces no precisaron.,Pende jukahárakuéra añete'eha nokotevẽikuri.
Este auxiliar culpable no dispone tu docente audaz.,Ko pytyvõhára angaipáva nomoĩri ne ombo'éva py'aguasu.
Nuestro participante siguiente no atenuaba aquella base enorme.,Ñane ha'ãra uperiregua nomomichĩrimi aipo guapyha popeno.
Esta inferior juez no iniciaba.,Ko yvyraja iguypegua noñepyrũimi.
Esa indígena flamante acababa.,Upe ava piriri opami.
Mis semejantes orales perdieron.,Che rapichakuéra jurugua ombyaikuri.
Tu humilde dirigente cambiaba aquel diferente frente.,Ne myenondehára tindy ojerovami amo tova ambue.
Nuestros habitantes prepotentes no mantienen.,Ore yvypórakuéra mbarete nomongarui.
Las guaraníses veraces florecían.,Avañe'ẽnguéra japu'ỹva opotyjerami.
Mi juez común no reparte vuestro latente compatriota.,Che yvyrajára tapiagua nomboja'oi pene tetãygua kañy.
Los peces transparentes cayeron.,Pirakuéra satĩ ho'akuri.
Aquel adolescente mayor no investigaba.,Aipo mitãrusu tuichave nomboguyguyimi.
Vuestro final participante causaba la deforme agente.,Pende apýra oikéva ombojehumi tahachi ñepã.
Vuestro final participante causaba la deforme agente.,Pene ha'ãra pahague ombojehumi tahachi kucha'ã.
Aquellas mañanas impares obraban.,Umi pyharevekuéra joja'ỹ okakami.
